{
  "schema_version": "1.0",
  "job_id": "cm-video-level1-explicit-cm-vs-cm-ir-16x9-v1",
  "video_id": "explicit-cm-vs-cm-ir",
  "brief_hash": "68821897ef83df0b4c04dd822fbc1296a6f03ab2f29e89f5c2d32293280a31de",
  "resolved_spec_hash": "b999b06fbee6b78cb68cc37e4e5ee341f0daba033591877e934dd505447a47f6",
  "renderer_revision": "81af0adec2e74bd0a0fa28a99cc0884dbb9b77ec",
  "orchestrator_revision": "81af0adec2e74bd0a0fa28a99cc0884dbb9b77ec",
  "evidence_hashes": {
    "src-bitset": "06a9a24a0bc1e579840d0349803353c08b86f7dd15bc7f9bad7d557d9f0c9cdf",
    "src-cm-build": "325987a6778feb09f2ff2e3a6a1f21e672ea1696c294f063261b2f5fbfabb33e",
    "src-cm-ir": "3e0958785ec6e34cefa2a55093c0cc8b7787a6923549d05d90b45730776bb365",
    "src-correction-report": "878336141ef1fc5a6a6fc78db7ca57cc18468076df18378bc05bb3a4a7e1c046",
    "src-epfl-report": "352766bd96842f971d3de0d2d4adb805d96d7527512650373f4a680d2ab30fc4",
    "src-repo-readme": "217d70d53873ff613ee9cdaedd3c887c69f44f6fc0f49e14c0a953815312bc87"
  },
  "format": {
    "name": "16x9",
    "width": 1920,
    "height": 1080,
    "fps": 30
  },
  "resources": {
    "class": "cpu-chromium-small",
    "cpu": 4,
    "ram_gb": 8,
    "gpu": false
  },
  "cache_identity": "26ada674b3b4b6da72702734de6c9e3a406549c9eb047dc9cf293f3c7db9d927",
  "output_directory": "proofs/explicit-cm-vs-cm-ir/ivc-output",
  "retry_policy": {
    "max_attempts": 2,
    "timeout_seconds": 1800,
    "retry_same_hash_only": true
  }
}
